{
  "$schema": "https://o2csi.github.io/candeo/device-definition.schema.json",
  "name": "Alienware m17 R5 zones",
  "notes": [
    "Unverified: never tried on this machine. Written on 2026-10-16 by alienfx.mjs from alienfx-tools, https://github.com/T-Troll/alienfx-tools, MIT licence, commit 3289c320 (2026-10-14): alienfx-gui/Mappings/devices.csv, each machine's map of its lights.",
    "Its map there: “Alienware m17R5”, line 590, device “Tron lights”. Which id lights what is that map's; the names are its own, in plain words.",
    "The protocol is verified: the AW-ELC's live preview, as alienware-17-r5-zones.json sends it, which stores nothing in the device.",
    "Matched on the machine (#326): SMBIOS names it “Alienware m17 R5 AMD”, as dmidecode reports it in linuxhw/DMI, https://github.com/linuxhw/DMI (CC BY 4.0), commit 57b21bc6 (2025-01-06): Notebook/Alienware/m17/m17 R5 AMD, SKU 0B5D; the m17 R5 is sold in that edition only.",
    "Left out: id 0, “Left of Tron”, which alienfx-tools marks as the power button: the firmware drives it, as on the m18 R1.",
    "alienfx-tools does not mark id 2, “Power button”, as the power button: it is drawn, as the 17 R5's is.",
    "alienfx-tools marks id 3, “AlienHead”, as an indicator, which it keeps dark when the lights are off; here it follows the effect.",
    "alienfx-tools names id 2 the power button yet marks id 0 as one: which of the two the firmware keeps, only the machine can say.",
    "Drawn from the front, lid open, the lights at the back seen through the hinge. Where a light sits is not in the source: the keyboard zones keep the order and widths of alienfx-tools' grid, the rest is drawn where its name puts it.",
    "Does it light? Say so: https://github.com/o2csi/candeo/issues/new?template=device-report.yml"
  ],
  "match": { "vid": "187c", "pid": "0550", "usagePage": "ff00", "usage": "0001", "machine": "Alienware m17 R5 AMD" },
  "report": { "wire": "output", "length": 33, "prefix": "00" },
  "frame": {
    "pace": { "atLeastMs": 100, "skipUnchanged": true },
    "open": ["03 21 00 01 ff ff"],
    "each": {
      "group": "colour",
      "chunk": 4,
      "send": ["03 23 01 00 {count} {addresses}", "03 24 00 07 d0 00 fa {r} {g} {b}"]
    },
    "close": ["03 21 00 03 00 ff"]
  },
  "lights": {
    "kind": "zones",
    "items": [
      { "name": "right of the ring", "address": 1, "rect": [8.05, 8.1, 6.95, 0.8] },
      { "name": "power button", "address": 2, "shape": "disc", "rect": [7.6, 9.4, 0.8, 0.8] },
      { "name": "alien head on the lid", "address": 3, "shape": "disc", "rect": [7.2, 2.4, 1.6, 2] }
    ]
  },
  "outline": [{ "rect": [0.5, 0, 15, 8], "r": 0.5 }, { "rect": [0, 9, 16, 9.5], "r": 0.8 }],
  "examples": [
    {
      "colours": ["ff0000", "00ff00", "0000ff"],
      "reports": [
        "03 21 00 01 ff ff",
        "03 23 01 00 01 01",
        "03 24 00 07 d0 00 fa ff 00 00",
        "03 23 01 00 01 02",
        "03 24 00 07 d0 00 fa 00 ff 00",
        "03 23 01 00 01 03",
        "03 24 00 07 d0 00 fa 00 00 ff",
        "03 21 00 03 00 ff"
      ]
    }
  ]
}
